{
  "schemaVersion": 1,
  "methodologyVersion": "1.0.0",
  "universe": "uk-100",
  "joinKey": "slug",
  "generatedAt": "2026-10-30T11:30:57.065564Z",
  "asOfDate": "2026-10-29",
  "companyCount": 100,
  "companies": {
    "airtel-africa": {
      "companyName": "Airtel Africa PLC",
      "ticker": "AAF.L",
      "slug": "airtel-africa",
      "date": "2026-10-29",
      "dailyScore": 56.6,
      "dailyLabel": "Slightly positive",
      "rollingScore": 52.2,
      "confidence": 43.7,
      "confidenceBand": "medium",
      "coverageStatus": "ok",
      "storyCount": 3,
      "sourceCount": 2,
      "changeFromPreviousScoredDay": 2.2,
      "flags": []
    },
    "anglo-american": {
      "companyName": "Anglo American PLC",
      "ticker": "AAL.L",
      "slug": "anglo-american",
      "date": "2026-10-29",
      "dailyScore": 66.3,
      "dailyLabel": "Positive",
      "rollingScore": 52.6,
      "confidence": 75.7,
      "confidenceBand": "high",
      "coverageStatus": "ok",
      "storyCount": 5,
      "sourceCount": 5,
      "changeFromPreviousScoredDay": 29.0,
      "flags": [
        {
          "type": "earnings_beat",
          "direction": "positive",
          "severity": "medium",
          "status": "possible"
        },
        {
          "type": "sentiment_jump",
          "direction": "positive",
          "severity": "high",
          "status": "calculated",
          "detail": "Daily score increased by 29.0 points"
        },
        {
          "type": "good_press",
          "direction": "positive",
          "severity": "medium",
          "status": "calculated",
          "detail": "Daily press score is 66.3"
        }
      ]
    },
    "aberdeen-group": {
      "companyName": "Aberdeen Group PLC",
      "ticker": "ABDN.L",
      "slug": "aberdeen-group",
      "date": "2026-10-29",
      "dailyScore": 42.9,
      "dailyLabel": "Slightly negative",
      "rollingScore": 46.6,
      "confidence": 85.6,
      "confidenceBand": "high",
      "coverageStatus": "ok",
      "storyCount": 69,
      "sourceCount": 47,
      "changeFromPreviousScoredDay": 2.6,
      "flags": []
    },
    "associated-british-foods": {
      "companyName": "Associated British Foods PLC",
      "ticker": "ABF.L",
      "slug": "associated-british-foods",
      "date": "2026-10-29",
      "dailyScore": 50.5,
      "dailyLabel": "Neutral / mixed",
      "rollingScore": 48.3,
      "confidence": 15.2,
      "confidenceBand": "low",
      "coverageStatus": "ok",
      "storyCount": 1,
      "sourceCount": 1,
      "changeFromPreviousScoredDay": 10.2,
      "flags": [
        {
          "type": "low_confidence",
          "direction": "neutral",
          "severity": "low",
          "status": "calculated",
          "detail": "Confidence is 15.2"
        }
      ]
    },
    "admiral": {
      "companyName": "Admiral Group PLC",
      "ticker": "ADM.L",
      "slug": "admiral",
      "date": "2026-10-29",
      "dailyScore": null,
      "dailyLabel": "No coverage",
      "rollingScore": 50.1,
      "confidence": 0.0,
      "confidenceBand": "low",
      "coverageStatus": "no_coverage",
      "storyCount": 0,
      "sourceCount": 0,
      "changeFromPreviousScoredDay": null,
      "flags": [
        {
          "type": "no_coverage",
          "direction": "neutral",
          "severity": "low",
          "status": "calculated",
          "detail": "Collection succeeded but found no eligible coverage"
        }
      ]
    },
    "alliance-witan": {
      "companyName": "Alliance Witan PLC",
      "ticker": "ALW.L",
      "slug": "alliance-witan",
      "date": "2026-10-29",
      "dailyScore": 50.5,
      "dailyLabel": "Neutral / mixed",
      "rollingScore": 50.2,
      "confidence": 15.2,
      "confidenceBand": "low",
      "coverageStatus": "ok",
      "storyCount": 1,
      "sourceCount": 1,
      "changeFromPreviousScoredDay": 1.6,
      "flags": [
        {
          "type": "low_confidence",
          "direction": "neutral",
          "severity": "low",
          "status": "calculated",
          "detail": "Confidence is 15.2"
        }
      ]
    },
    "antofagasta": {
      "companyName": "Antofagasta PLC",
      "ticker": "ANTO.L",
      "slug": "antofagasta",
      "date": "2026-10-29",
      "dailyScore": 44.9,
      "dailyLabel": "Slightly negative",
      "rollingScore": 47.9,
      "confidence": 61.3,
      "confidenceBand": "medium",
      "coverageStatus": "ok",
      "storyCount": 7,
      "sourceCount": 2,
      "changeFromPreviousScoredDay": -1.1,
      "flags": []
    },
    "auto-trader": {
      "companyName": "Auto Trader Group PLC",
      "ticker": "AUTO.L",
      "slug": "auto-trader",
      "date": "2026-10-29",
      "dailyScore": 49.7,
      "dailyLabel": "Neutral / mixed",
      "rollingScore": 50.9,
      "confidence": 15.7,
      "confidenceBand": "low",
      "coverageStatus": "ok",
      "storyCount": 1,
      "sourceCount": 1,
      "changeFromPreviousScoredDay": 0.0,
      "flags": [
        {
          "type": "interim_results",
          "direction": "neutral",
          "severity": "medium",
          "status": "possible"
        },
        {
          "type": "low_confidence",
          "direction": "neutral",
          "severity": "low",
          "status": "calculated",
          "detail": "Confidence is 15.7"
        }
      ]
    },
    "aviva": {
      "companyName": "Aviva PLC",
      "ticker": "AV.L",
      "slug": "aviva",
      "date": "2026-10-29",
      "dailyScore": 45.4,
      "dailyLabel": "Neutral / mixed",
      "rollingScore": 52.6,
      "confidence": 83.9,
      "confidenceBand": "high",
      "coverageStatus": "ok",
      "storyCount": 14,
      "sourceCount": 14,
      "changeFromPreviousScoredDay": -12.6,
      "flags": [
        {
          "type": "sentiment_drop",
          "direction": "negative",
          "severity": "high",
          "status": "calculated",
          "detail": "Daily score decreased by 12.6 points"
        }
      ]
    },
    "astrazeneca": {
      "companyName": "AstraZeneca",
      "ticker": "AZN.L",
      "slug": "astrazeneca",
      "date": "2026-10-29",
      "dailyScore": 71.9,
      "dailyLabel": "Positive",
      "rollingScore": 64.2,
      "confidence": 87.0,
      "confidenceBand": "high",
      "coverageStatus": "ok",
      "storyCount": 13,
      "sourceCount": 14,
      "changeFromPreviousScoredDay": 4.4,
      "flags": [
        {
          "type": "good_press",
          "direction": "positive",
          "severity": "medium",
          "status": "calculated",
          "detail": "Daily press score is 71.9"
        }
      ]
    },
    "bae-systems": {
      "companyName": "BAE Systems",
      "ticker": "BA.L",
      "slug": "bae-systems",
      "date": "2026-10-29",
      "dailyScore": 70.4,
      "dailyLabel": "Positive",
      "rollingScore": 62.5,
      "confidence": 89.2,
      "confidenceBand": "high",
      "coverageStatus": "ok",
      "storyCount": 26,
      "sourceCount": 27,
      "changeFromPreviousScoredDay": -7.1,
      "flags": [
        {
          "type": "good_press",
          "direction": "positive",
          "severity": "medium",
          "status": "calculated",
          "detail": "Daily press score is 70.4"
        }
      ]
    },
    "babcock-international": {
      "companyName": "Babcock International Group PLC",
      "ticker": "BAB.L",
      "slug": "babcock-international",
      "date": "2026-10-29",
      "dailyScore": 54.1,
      "dailyLabel": "Neutral / mixed",
      "rollingScore": 50.9,
      "confidence": 16.5,
      "confidenceBand": "low",
      "coverageStatus": "ok",
      "storyCount": 1,
      "sourceCount": 1,
      "changeFromPreviousScoredDay": 3.8,
      "flags": [
        {
          "type": "low_confidence",
          "direction": "neutral",
          "severity": "low",
          "status": "calculated",
          "detail": "Confidence is 16.5"
        }
      ]
    },
    "barclays": {
      "companyName": "Barclays",
      "ticker": "BARC.L",
      "slug": "barclays",
      "date": "2026-10-29",
      "dailyScore": 49.0,
      "dailyLabel": "Neutral / mixed",
      "rollingScore": 49.6,
      "confidence": 67.3,
      "confidenceBand": "medium",
      "coverageStatus": "ok",
      "storyCount": 8,
      "sourceCount": 4,
      "changeFromPreviousScoredDay": -1.0,
      "flags": [
        {
          "type": "coverage_spike",
          "direction": "neutral",
          "severity": "medium",
          "status": "calculated",
          "detail": "8 stories versus trailing median 1"
        }
      ]
    },
    "british-american-tobacco": {
      "companyName": "British American Tobacco",
      "ticker": "BATS.L",
      "slug": "british-american-tobacco",
      "date": "2026-10-29",
      "dailyScore": 43.2,
      "dailyLabel": "Slightly negative",
      "rollingScore": 47.7,
      "confidence": 61.4,
      "confidenceBand": "medium",
      "coverageStatus": "ok",
      "storyCount": 43,
      "sourceCount": 61,
      "changeFromPreviousScoredDay": -4.3,
      "flags": [
        {
          "type": "earnings_miss",
          "direction": "negative",
          "severity": "medium",
          "status": "confirmed"
        },
        {
          "type": "collection_degraded",
          "direction": "neutral",
          "severity": "medium",
          "status": "calculated",
          "detail": "The provider result ceiling was reached for this day"
        }
      ]
    },
    "tritax-big-box": {
      "companyName": "Tritax Big Box REIT PLC",
      "ticker": "BBOX.L",
      "slug": "tritax-big-box",
      "date": "2026-10-29",
      "dailyScore": 35.8,
      "dailyLabel": "Negative",
      "rollingScore": 48.6,
      "confidence": 31.0,
      "confidenceBand": "low",
      "coverageStatus": "ok",
      "storyCount": 2,
      "sourceCount": 1,
      "changeFromPreviousScoredDay": -15.4,
      "flags": [
        {
          "type": "low_confidence",